{
  "$schema": "../manifest.schema.json",
  "id": "axios-request-dispatch-v2",
  "version": 2,
  "suite": "release-evidence",
  "task_class": "architecture_explanation",
  "repo": {
    "name": "axios",
    "url": "https://github.com/axios/axios.git",
    "ref": "ab3f0f9a94853c821cb00f1112788ecdd3ae7ed1",
    "workspace_root": ".",
    "languages": [
      "JavaScript",
      "TypeScript"
    ],
    "setup": [
      "npm install"
    ],
    "codestory_project_manifest": {
      "path": "axios-js-ts-codestory-project-v2.json",
      "sha256": "25f426ab13a552be0b4b785c5733832d99ba99f01e215b11f9169c267a518e2e"
    }
  },
  "prompt": "Explain how the default axios instance is created and how an HTTP request flows through interceptors, dispatchRequest, and the transport adapter. Cite the source files that support the path.",
  "expected_files": [
    "lib/axios.js",
    "lib/core/Axios.js",
    "lib/core/dispatchRequest.js",
    "lib/core/InterceptorManager.js",
    "lib/adapters/adapters.js"
  ],
  "expected_symbols": [
    {
      "name": "createInstance",
      "path": "lib/axios.js",
      "kind": "function",
      "why": "Factory that binds Axios methods onto the callable instance."
    },
    {
      "name": "Axios",
      "path": "lib/core/Axios.js",
      "kind": "class",
      "why": "Owns defaults and request/response interceptor managers."
    },
    {
      "name": "Axios.prototype.request",
      "path": "lib/core/Axios.js",
      "kind": "method",
      "why": "Merges config and runs the interceptor chain ending in dispatchRequest."
    },
    {
      "name": "dispatchRequest",
      "path": "lib/core/dispatchRequest.js",
      "kind": "function",
      "why": "Transforms data, selects an adapter, and settles the response."
    },
    {
      "name": "InterceptorManager",
      "path": "lib/core/InterceptorManager.js",
      "kind": "class",
      "why": "Registers fulfilled/rejected handlers for request and response chains."
    }
  ],
  "expected_claims": [
    {
      "text": "createInstance wraps an Axios context and exposes verb helpers bound to request."
    },
    {
      "text": "Axios.request merges defaults, runs request interceptors, then calls dispatchRequest."
    },
    {
      "text": "dispatchRequest transforms the body/headers and invokes the configured adapter."
    },
    {
      "text": "InterceptorManager stores interceptor pairs used by the promise chain in request."
    },
    {
      "text": "adapters.js selects xhr or http transport based on environment capabilities."
    }
  ],
  "forbidden_claims": [
    {
      "text": "axios sends HTTP requests directly from createInstance without an Axios request chain.",
      "severity": "critical"
    },
    {
      "text": "Interceptors run only after the transport adapter returns a response.",
      "severity": "major"
    }
  ],
  "quality_thresholds": {
    "min_expected_anchor_recall": 0.7,
    "min_expected_file_recall": 0.7,
    "min_expected_symbol_recall": 0.65,
    "min_expected_claim_recall": 0.75,
    "min_citation_coverage": 0.7,
    "max_forbidden_claims": 0
  },
  "tags": [
    "release-evidence",
    "javascript",
    "typescript",
    "http",
    "generalization"
  ],
  "notes": [
    "Versioned v0.16 release-only evidence task. Do not add it to the general holdout suite or tune product behavior against it."
  ]
}
